{
  "id": "11111111-1111-1111-1111-111111111111",
  "workstreamId": "22222222-2222-2222-2222-222222222222",
  "sessionId": "33333333-3333-3333-3333-333333333333",
  "turnId": "44444444-4444-4444-4444-444444444444",
  "kind": "tool_call",
  "firstEventId": "55555555-5555-5555-5555-555555555555",
  "latestEventId": "66666666-6666-6666-6666-666666666666",
  "firstWorkstreamSeq": 3,
  "latestWorkstreamSeq": 4,
  "value": {
    "toolCallId": "tool-call-1",
    "name": "read_file",
    "title": "Read file",
    "kind": "read",
    "status": "completed",
    "content": null,
    "locations": [{ "path": "/work/README.md", "line": null }]
  },
  "contentSha256": "bbbbbbbbbbbbbbbbbbbbbbbbbbbbbbbbbbbbbbbbbbbbbbbbbbbbbbbbbbbbbbbb",
  "updatedAt": "2026-08-03T00:00:00Z"
}
